{
  "manifest_kind": "tale_authoring_content_groups",
  "schema_version": 1,
  "tale_id": "drowned_harbor",
  "manifest_id": "drowned_harbor_world_content",
  "production_status": "design_only",
  "groups": [
    {
      "kind": "mode",
      "status": "preproduction_ready",
      "privacy": "public",
      "stages": [],
      "tags": ["mechanical_truth_required"],
      "source_path": "docs/tales/drowned_harbor/Drowned_Harbor_Design_Bible.md",
      "source_anchor": "## 17. Cooperative",
      "traceability_concepts": ["DH-XM-001"],
      "ids": ["cooperative"],
      "note": "Supported no-hidden-enemy baseline and low-seat fallback."
    },
    {
      "kind": "mode",
      "status": "preproduction_ready",
      "privacy": "controlled_reveal_private",
      "stages": [],
      "tags": ["controlled_reveal_required", "mechanical_truth_required", "optional_hidden_state"],
      "source_path": "docs/tales/drowned_harbor/Drowned_Harbor_Design_Bible.md",
      "source_anchor": "## 18. Hidden Betrayer",
      "traceability_concepts": ["DH-XM-009"],
      "ids": ["hidden_betrayer"],
      "note": "Supported Bellmarked overlay mode with seat-count-valid hidden allegiance and cooperative fallback."
    },
    {
      "kind": "mode",
      "status": "deferred",
      "privacy": "controlled_reveal_private",
      "stages": [],
      "tags": ["controlled_reveal_required", "mechanical_truth_required", "optional_hidden_state"],
      "source_path": "docs/tales/drowned_harbor/Drowned_Harbor_Design_Bible.md",
      "source_anchor": "## 20. Hunted and Rival Crews candidates",
      "traceability_concepts": [],
      "ids": ["hunted"],
      "note": "Deferred Hunted mode pending Drowned Keeper, seat-count, balance, privacy, and human review."
    },
    {
      "kind": "mode",
      "status": "preproduction_ready",
      "privacy": "controlled_reveal_private",
      "stages": [],
      "tags": ["controlled_reveal_required", "mechanical_truth_required", "optional_hidden_state", "stable_seat_continuation"],
      "source_path": "docs/tales/drowned_harbor/Drowned_Harbor_Design_Bible.md",
      "source_anchor": "## 19. Outbreak",
      "traceability_concepts": ["DH-XM-010"],
      "ids": ["outbreak"],
      "note": "Supported dynamic Tidebound conversion mode with cooperative fallback."
    },
    {
      "kind": "mode",
      "status": "deferred",
      "privacy": "public",
      "stages": [],
      "tags": ["mechanical_truth_required"],
      "source_path": "docs/tales/drowned_harbor/Drowned_Harbor_Design_Bible.md",
      "source_anchor": "## 20. Hunted and Rival Crews candidates",
      "traceability_concepts": [],
      "ids": ["rival_crews"],
      "note": "Deferred public competing-crew mode pending exact success conditions and human evidence."
    },
    {
      "kind": "region",
      "status": "preproduction_ready",
      "privacy": "public",
      "stages": [],
      "tags": ["mechanical_truth_required"],
      "source_path": "docs/tales/drowned_harbor/Drowned_Harbor_Design_Bible.md",
      "source_anchor": "### Regions",
      "traceability_concepts": ["DH-XM-002"],
      "ids": ["high_ground", "lighthouse_region", "lower_harbor", "outer_mudflats", "submerged_depths", "town_center"],
      "note": "Public board-region identities; exact space membership remains future board-authority data."
    },
    {
      "kind": "space",
      "status": "preproduction_ready",
      "privacy": "public",
      "stages": [],
      "tags": ["authored_recovery_required", "mechanical_truth_required"],
      "source_path": "docs/tales/drowned_harbor/Drowned_Harbor_Design_Bible.md",
      "source_anchor": "### Core spaces",
      "traceability_concepts": ["DH-XM-002", "DH-XM-003", "DH-XM-005", "DH-XM-007"],
      "ids": [
        "bellhouse_square",
        "breakwater",
        "drowned_archive",
        "harbor_office",
        "lifeboat_shed",
        "lighthouse_base",
        "lighthouse_lantern_room",
        "mudflat_approach",
        "netmakers_row",
        "old_ferry_slip",
        "salt_market",
        "tide_chapel",
        "wreckers_lane"
      ],
      "note": "Public board-space identities; every tide state requires an authored route, visibility, hazard, and recovery state."
    },
    {
      "kind": "stage",
      "status": "preproduction_ready",
      "privacy": "public",
      "stages": ["bellhouse_ledger"],
      "tags": ["mechanical_truth_required"],
      "source_path": "docs/tales/drowned_harbor/Drowned_Harbor_Design_Bible.md",
      "source_anchor": "## 13. Stage 2 — The Bellhouse Ledger",
      "traceability_concepts": ["DH-XM-003", "DH-XM-004"],
      "ids": ["bellhouse_ledger"],
      "note": "Ledger priority and unresolved-name stage."
    },
    {
      "kind": "stage",
      "status": "preproduction_ready",
      "privacy": "public",
      "stages": ["high_water"],
      "tags": ["mechanical_truth_required"],
      "source_path": "docs/tales/drowned_harbor/Drowned_Harbor_Design_Bible.md",
      "source_anchor": "## 15. Stage 4 — High Water",
      "traceability_concepts": ["DH-XM-006"],
      "ids": ["high_water"],
      "note": "Flooded transformation stage with route, rescue, faction, form, and resource pressure."
    },
    {
      "kind": "stage",
      "status": "preproduction_ready",
      "privacy": "public",
      "stages": ["last_light"],
      "tags": ["mechanical_truth_required"],
      "source_path": "docs/tales/drowned_harbor/Drowned_Harbor_Design_Bible.md",
      "source_anchor": "## 16. Stage 5 — The Last Light",
      "traceability_concepts": ["DH-XM-012", "DH-XM-013"],
      "ids": ["last_light"],
      "note": "Final authoritative option and outcome-attribution stage."
    },
    {
      "kind": "stage",
      "status": "preproduction_ready",
      "privacy": "public",
      "stages": ["lighthouse_council"],
      "tags": ["mechanical_truth_required"],
      "source_path": "docs/tales/drowned_harbor/Drowned_Harbor_Design_Bible.md",
      "source_anchor": "## 14. Stage 3 — Council Beneath the Lighthouse",
      "traceability_concepts": ["DH-XM-005"],
      "ids": ["lighthouse_council"],
      "note": "Public lighthouse direction choice and High Water commitment stage."
    },
    {
      "kind": "stage",
      "status": "preproduction_ready",
      "privacy": "public",
      "stages": ["low_tide_arrival"],
      "tags": ["mechanical_truth_required"],
      "source_path": "docs/tales/drowned_harbor/Drowned_Harbor_Design_Bible.md",
      "source_anchor": "## 12. Stage 1 — The Harbor at Low Tide",
      "traceability_concepts": ["DH-XM-002"],
      "ids": ["low_tide_arrival"],
      "note": "Entry, exploration, landmark, and first-record stage."
    },
    {
      "kind": "tide_state",
      "status": "preproduction_ready",
      "privacy": "public",
      "stages": ["last_light"],
      "tags": ["deterministic_consequence", "mechanical_truth_required"],
      "source_path": "docs/tales/drowned_harbor/Drowned_Harbor_Design_Bible.md",
      "source_anchor": "### Tide states",
      "traceability_concepts": ["DH-XM-012", "DH-XM-013"],
      "ids": ["final_submergence"],
      "note": "Terminal public tide state that proceeds directly to deterministic resolution."
    },
    {
      "kind": "tide_state",
      "status": "preproduction_ready",
      "privacy": "public",
      "stages": ["high_water"],
      "tags": ["deterministic_consequence", "mechanical_truth_required"],
      "source_path": "docs/tales/drowned_harbor/Drowned_Harbor_Design_Bible.md",
      "source_anchor": "### Tide states",
      "traceability_concepts": ["DH-XM-006"],
      "ids": ["flooded_streets"],
      "note": "Public High Water tide state with transformed land and water routes."
    },
    {
      "kind": "tide_state",
      "status": "preproduction_ready",
      "privacy": "public",
      "stages": ["high_water", "last_light"],
      "tags": ["deterministic_consequence", "mechanical_truth_required"],
      "source_path": "docs/tales/drowned_harbor/Drowned_Harbor_Design_Bible.md",
      "source_anchor": "### Tide states",
      "traceability_concepts": ["DH-XM-006", "DH-XM-012"],
      "ids": ["harbor_claim"],
      "note": "Late public tide state increasing Harbor pressure without replacing authoritative options."
    },
    {
      "kind": "tide_state",
      "status": "preproduction_ready",
      "privacy": "public",
      "stages": ["low_tide_arrival", "bellhouse_ledger", "lighthouse_council"],
      "tags": ["deterministic_consequence", "mechanical_truth_required"],
      "source_path": "docs/tales/drowned_harbor/Drowned_Harbor_Design_Bible.md",
      "source_anchor": "### Tide states",
      "traceability_concepts": ["DH-XM-002"],
      "ids": ["lowest_tide", "returning_tide"],
      "note": "Public pre-High-Water tide states with authored route, visibility, and pressure behavior."
    }
  ]
}
